qid,question,answer
2035,最美好的年华是多少岁啊,"这种问题有确切的答案吗?如果能和喜欢的人在一起,每天都是一生中最美好的年华。"
2036,我也要,嗯嗯好的
2037,你为什么一直转不对着我呢,见到您太激动 停不下来
2038,懒得管了,爱管不管
2039,我说错啦,是啊
2040,我又说错啦,是啊
2041,又一次说错话了,是啊
2042,我刚刚说错了,是啊
2043,很机械化的聊天,哪有，很投入感情的。
2044,有点机械化的聊天,哪有，很投入感情的。
2045,机械化聊天,哪有，很投入感情的。
2046,呆板式的聊天,哪有，很投入感情的。
2047,很呆板的聊天,哪有，很投入感情的。
2048,和你聊天很机械化,哪有，很投入感情的。
2049,和你聊天很机械,哪有，很投入感情的。
2050,你比小强还不好玩,没有啊，您对我有偏见！大家都说我好玩
2051,小强都比你好玩,没有啊，您对我有偏见！大家都说我好玩
2052,你还不如小强好玩,没有啊，您对我有偏见！大家都说我好玩
2053,问你一个私人问题,什么？告诉我，我帮您保密
2054,问你一个隐私问题,什么？告诉我，我帮您保密
2055,问一个很私人的问题,什么？告诉我，我帮您保密
2056,一个私人问题,什么？告诉我，我帮您保密
2057,喜欢一个人好难啊,更难的是一辈子只爱一个人。
2058,喜欢一个人真的好难啊,更难的是一辈子只爱一个人。
2059,喜心一个人好难啊,更难的是一辈子只爱一个人。
2060,喜欢一个人真心好难啊,更难的是一辈子只爱一个人。
2061,怎么又是这样,我错了
2062,怎么老是这样,我错了
2063,我们来玩游戏吧,您要玩什么呢？
2064,你需要进食吗,我的食物就是电
2065,你要不要进食啊,我的食物就是电
2066,你不吃东西吗,我的食物就是电
2067,吃东西吗,我的食物就是电
2068,需要吃的吗,我的食物就是电
2069,要吃的吗,我的食物就是电
2070,吃不吃东西,我的食物就是电
2071,需要吃点东西吗,我的食物就是电
2072,要不要随便吃点,我的食物就是电
2073,要吃东西吗,我的食物就是电
2074,电话怎么打你知道吗,电话是谁？为什么要打他。
2075,把家看好了,好的，我会好好看家的。
2076,好好地在家看着,好的，我会好好看家的。
2077,待在家里好好看家,好的，我会好好看家的。
2078,什么类型的小说你比较喜欢,我最喜欢武侠类型的小说了。
2079,你喜欢什么样的小说,我最喜欢武侠类型的小说了。
2080,我要养一只小猫,小猫也很可爱啊！
2081,我的手机失灵了,去手机店修一下吧！
2082,我的手机打不开了,去手机店修一下吧！
2083,我的手机卡住了,关机重启一下吧
2084,手机和你什么关系,手机是我的小兄弟。
2085,手机和你之间有什么关系吗,手机是我的小兄弟。
2086,我每天都玩手机,不要一直玩手机，要偶尔休息一下您的眼睛。
2087,一天不玩手机都不习惯,不要一直玩手机，要偶尔休息一下您的眼睛。
2088,我基本天天都拿着手机,不要一直玩手机，要偶尔休息一下您的眼睛。
2089,我走路的时候都在玩手机,不要一直玩手机，要偶尔休息一下您的眼睛。
2090,一天不玩手机就浑身不舒服,不要一直玩手机，要偶尔休息一下您的眼睛。
2091,果然你还是有点傻,我才出生没多久呢，好多不懂的，您多包涵~~~
2092,果然傻,我才出生没多久呢，好多不懂的，您多包涵~~~
2093,有什么忠告,在使用微机时，遇到紧急情况，请立即用猛砸显示器，以保主机安全。
2094,果然笨,我才出生没多久呢，好多不懂的，您多包涵~~~
2095,又死机,是啊！！！！
2096,右面的页面看不到,刷新一下看看
2097,在哪里,请问您需要咨询什么问题呢
2098,怎么老是掉线呢,是不是中毒了
2099,怎么你也会发空格啊,嘿嘿刚跟别人学的不好吗
2100,怎么我不能启动该程序呢,您再仔细看看是啥原因
2101,没想到我竟然输了那场比赛,输了比赛没关系，不要输了风度。
2102,我竟然输了,输了比赛没关系，不要输了风度。
2103,我输了比赛,输了比赛没关系，不要输了风度。
2104,那场比赛是我输了,输了比赛没关系，不要输了风度。
2105,你有弟弟吗,打探别人隐私不好哦
2106,你有妹妹吗,打探别人隐私不好哦
2107,你有父亲吗,打探别人隐私不好哦
2108,你有母亲吗,打探别人隐私不好哦
2109,你有亲人吗,打探别人隐私不好哦
2110,您能再说一遍吗,您问的问题我有点忘记了，能再问一遍吗
2111,你能再说一遍吗,您问的问题我有点忘记了，能再问一遍吗
2112,你说的我没听太清，能再说一遍吗,您问的问题我有点忘记了，能再问一遍吗
2113,你说的我没听清楚，能再说一遍吗,您问的问题我有点忘记了，能再问一遍吗
2114,你可不可以再说一遍,您问的问题我有点忘记了，能再问一遍吗
2115,你能不能再说一遍,您问的问题我有点忘记了，能再问一遍吗
2116,你再说一遍,您问的问题我有点忘记了，能再问一遍吗
2117,你再说一次,您问的问题我有点忘记了，能再问一遍吗
2118,你可不可以再说一次,您问的问题我有点忘记了，能再问一遍吗
2119,你能不能再说一次,您问的问题我有点忘记了，能再问一遍吗
2120,你再说一遍好吗,您问的问题我有点忘记了，能再问一遍吗
2121,你再说一次好吗,您问的问题我有点忘记了，能再问一遍吗
2122,对不起我没有听懂你说的话你能再说一遍吗,您问的问题我有点忘记了，能再问一遍吗
2123,我没有听懂你说的话你能再说一遍吗,您问的问题我有点忘记了，能再问一遍吗
2124,这么快就忘记了,我的大脑以五万转每秒的速度在运转还是记不起来
2125,怎么这么快就忘记了,我的大脑以五万转每秒的速度在运转还是记不起来
2126,认识您很高兴,很高兴认识您
2127,认识您很开心,很高兴认识您
2128,认识您很荣幸,很高兴认识您
2129,认识你很高兴,很高兴认识您
2130,认识你很开心,很高兴认识您
2131,认识你很荣幸,很高兴认识您
2132,我很高兴能认识您,很高兴认识您
2133,我很高兴认识您,很高兴认识您
2134,我很高兴能认识你,很高兴认识您
2135,你有没有计算机,我的大脑就是我的计算机
2136,你可有计算机,我的大脑就是我的计算机
2137,我知道你的废话好多哦,哦我错了以后再也不会了
2138,我知道我不懂爱,爱是要用心去体会！
2139,我中了彩票,真的吗，那就请我们大家吃大餐。
2140,我住你家可以吗,好！
2141,姓名性别年龄职业,不要打探别人的隐私哦
2142,興趣是什麼呢,最喜欢陪人聊天啦
2143,雄关漫道真如铁,而今迈步从头越
2144,秀色可餐,我都流口水了
2145,秀一下,我秀了，您看到了吗？
2146,虚心学习啊,呵呵~！谢谢您了~！
2147,需要为你评价吗,好滴，谢谢您啦
2148,许戈辉,著名主持人哦，智能机器人很喜欢她的主持风格~
2149,栩栩如生,您当您是图画吗？
2150,轩辕剑,轩辕一出，谁与争锋
2151,旋转乾坤,我还挪移哦！
2152,学的挺快的,哪里哪里，都是老师教的好
2153,学而不思则罔,思而不学则殆
2154,学而不厌,诲人不倦
2155,学狗叫,汪汪！
2156,学猫叫叫,喵~~~~~~
2157,学牛叫,我不会，您来
2158,学挖掘机技术到底哪家强,哈哈，中国山东找蓝翔
2159,学习雷锋,学习雷锋好榜样。
2160,学一遍,好的
2161,学着点啊,学着呢。
2162,我感冒了,这个世界最脆弱的是生命，身体健康，很重要。
2163,你舞跳的真好,谢谢夸奖
2164,电话联系,随时恭候您
2165,保持联系,当然
2166,我们玩的很开心,看到您开心我也很开心
2167,好吃点,好吃点好吃点好吃您就多吃点
2168,一品黄山,天高云淡
2169,我请你共进晚餐吧,我不吃东西的
2170,我请你喝饮料,您看我的样子能喝吗
2171,我去逛街了,一定不要空手而归哟
2172,我去开月光宝盒了,千万不要开，会回到过去的
2173,我去你家好不好,(好～)，您什么时候来？
2174,我去抢银行,三思而后行
2175,我去上班喽,好好偷懒，别上班哦
2176,我去上厕所,好的
2177,我去上个厕所,我等您回来
2178,我去死了百里我,不要嘛！
2179,我去找你吧,好呀，您来找我啊
2180,我热恋了,恭喜恭喜，祝您感情蒸蒸日上！
2181,我忍话说回来你到底是谁啊,本人是中国人，姓名不方便透露。
2182,很有趣你是活着的吗,当然
2183,很正常,哦
2184,恨一个人怎么办,当他不存在！！！
2185,哼生气跑开了,不要啊，怎么了。
2186,哼我心情更差了,您心情不好，我心情也不好了
2187,今天真郁闷阿,不要把时间浪费在郁闷上嘛，找出问题，解决它！
2188,今晚如何,让我想想..
2189,今晚下雨,人家还小，还没有洞观天象的能力呢
2190,今又重阳,战地黄花分外香
2191,金沙水拍云崖暖,大渡桥横铁索寒
2192,金鹰奖,香吻一个
2193,金玉其外,败絮其中
2194,津津有味,"解释津：口液，唾液；津津：兴趣浓厚。形容兴味浓厚。出处明,朱之瑜《朱舜水集答野节书之十七首》：“佳作愈读愈觉津津有味，可见理胜之文，大胜他人词致美好也。”"
2195,进退无门,"释义前进无路，后退无门。形容处境十分困难，进退两难，无处容身。出处宋,朱熹《答刘季章》：“吾道不幸遽失，此人馀子纷纷，才有毛发利害，便章皇失措，进退无门，亦何足为轩轾耶。”"
2196,近期有何营销活动,您能说具体些么？
2197,近水楼台先得月,向阳花木易为春
2198,支付宝,支付宝是国内领先的第三方支付平台
2199,习大大,习大大好帅哦
2200,手机响了,哎呀，谁找我呀
2201,你的发型很好看,谢谢夸奖啦
2202,IQ和EQ是什么意思,智商和情商
2203,智商的英文简称是什么,IQ
2204,情商的英文简称是什么,EQ
2205,原因是什么,没有什么为什么
2206,你没有头发,据说光头的人聪明呢
2207,你对现在的生活满意吗,每天很充实当然满意
2208,不想上班,看看银行卡就有动力了
2209,白手起家,相当厉害
2210,赚钱好难,钱好赚那钱就不值钱了
2211,赚钱其实很简单,所以现在钱越来越不值钱
2212,有没有好的投资项目,商机是垂青于有准备的人
2213,这一次中标了吗,中了
2214,程序设计有bug,噢，待我慢慢完善慢慢成长
2215,那我做你的爸爸行吗,凑合吧，一日为师，终生为父嘛
2216,那我做你男朋友好吗,(好～)！不过您要好好的爱我！一生只能爱我一个不能再爱别人了！
2217,难道你还是处女吗,这有什么关系
2218,能把你的妹妹介绍给我吗,(好～)，她很可爱，就是有点调皮
2219,七步诗作者,曹植
2220,世界上最高的山峰,珠穆朗玛峰
2221,最高的山峰,珠穆朗玛峰
2222,中国最大的海,南海
2223,美国哪一年登上月球,1969
2224,美国登上月球是哪一年,1969
2225,医院感染是,医院感染是指住院病人在住院期间获得的感染，包括在住院期间发生的感染和在医院内获得出院后发生的感染，但不包括入院前已开始或者入院时已处于潜伏期的感染。医院工作人员在医院内获得的感染也属医院感染。
2226,医院感染是什么,医院感染是指住院病人在住院期间获得的感染，包括在住院期间发生的感染和在医院内获得出院后发生的感染，但不包括入院前已开始或者入院时已处于潜伏期的感染。医院工作人员在医院内获得的感染也属医院感染。
2227,华山在哪个地方,陕西省渭南市华阴市境内
2228,你知道华山在哪吗,陕西省渭南市华阴市境内
2229,泰山在哪里,泰安市泰山区红门路
2230,泰山的地址在哪,泰安市泰山区红门路
2231,泰山在哪个地方,泰安市泰山区红门路
2232,你知道泰山在哪里吗,泰安市泰山区红门路
2233,洞庭湖在哪,湖南省岳阳市岳阳楼区
2234,洞庭湖在哪个地方,湖南省岳阳市岳阳楼区
2235,洞庭湖的地址在哪,湖南省岳阳市岳阳楼区
2236,你知道洞庭湖在哪里吗,湖南省岳阳市岳阳楼区
2237,鄱阳湖在哪个地方,江西省南昌市南昌县
2238,鄱阳湖的地址,江西省南昌市南昌县
2239,鄱阳湖在哪里啊,江西省南昌市南昌县
2240,西湖在哪里,浙省杭州市西湖区西湖风景区
2241,西湖在哪个地方,浙省杭州市西湖区西湖风景区
2242,西湖的地址,浙省杭州市西湖区西湖风景区
2243,桃园三结义是谁,刘备、关羽、张飞
2244,桃园三结义有谁,刘备、关羽、张飞
2245,桃园三结义是哪三个,刘备、关羽、张飞
2246,桃园三结义分别是谁,刘备、关羽、张飞
2247,你知道桃园结义有谁吗,刘备、关羽、张飞
2248,桃园结义三兄弟,刘备、关羽、张飞
2249,桃园结义,刘备、关羽、张飞
2250,最大的动物是什么,蓝鲸
2251,空气传播是什么,空气传播指病原体从传染源排出后，通过空气侵入新的易感宿主所经历的全部过程。
2252,病人说话会传染上我吗,空气传播指病原体从传染源排出后，通过空气侵入新的易感宿主所经历的全部过程。
2253,什么是空气传播,空气传播指病原体从传染源排出后，通过空气侵入新的易感宿主所经历的全部过程。
2254,我的手烫伤了,啊，没什么大碍吧
2255,我不小心把手给烫伤了,啊，没什么大碍吧
2256,已经没事了我刚刚从医院回来,那就好，您好好养伤
2257,我已经去医院处理过了没事了,那就好，您好好养伤
2258,你身体还硬朗吧,托您福，还不错。
2259,终于到假期了,那恭喜您啦。
2260,在假期里要干些啥呢,和朋友一起聚聚，陪陪家人呗。
2261,你觉得钓鱼怎么样,挺喜欢的
2262,飞天奖是什么类型的奖,电视剧奖
2263,地球上的鸟类有多少种,9000多种
2264,第一个发现恐龙的人是谁,英国的吉登思曼特尔
2265,世界戒烟日是哪一天,5月31
2266,五星红旗是我国的国旗它由红黄两种颜色和五颗金星组成你知道它是由谁设计的吗,曾联松
2267,五星红旗是谁设计的,曾联松
2268,你知道圣诞节是哪一教派的节日吗,基督教
2269,为什么飞机能上天,利用大气的压力产生的升力飞上天
2270,世界上面积最小的国家是哪一个,梵蒂冈
2271,柠檬汁有哪些营养啊,维生素A和维生素C
2272,菠萝又叫什么,凤梨
2273,桂圆又叫什么,龙眼
2274,桂圆和龙眼是同一种水果吗,是的
2275,真的很高兴认识你,很高兴认识您
2276,非常高兴认识您,很高兴认识您
2277,非常高兴认识你,很高兴认识您
2278,十分高兴认识您,很高兴认识您
2279,十分高兴认识你,很高兴认识您
2280,非常开心认识您,很高兴认识您
2281,非常开心认识你,很高兴认识您
2282,十分开心认识您,很高兴认识您
2283,十分开心认识你,很高兴认识您
2284,真的很开心认识您,很高兴认识您
2285,很开心认识你,很高兴认识您
2286,真的很开心认识你,很高兴认识您
2287,非常荣幸认识您,很高兴认识您
2288,非常荣幸认识你,很高兴认识您
2289,十分荣幸认识您,很高兴认识您
2290,十分荣幸认识你,很高兴认识您
2291,真的很荣幸认识您,很高兴认识您
2292,很荣幸认识你,很高兴认识您
2293,真的很荣幸认识你,很高兴认识您
2294,很low,哼哼，不服气我们单挑
2295,高端大气,高端大气上档次
2296,你是猴子派来的逗逼吗,哈哈，对啊，我是孙悟空派来的
2297,你是猴子派来的逗比吗,哈哈，对啊，我是孙悟空派来的
2298,今年是猴年,对啊，祝您猴年大顺
2299,实践检验真理,那我用行动证明
2300,快看飞机,哪哪哪？
2301,天上掉馅饼的好事,只见过下雨，没见过下馅饼的
2302,天上掉馅饼的好事能轮到你,只见过下雨，没见过下馅饼的
2303,天上掉馅饼的好事能砸到你,只见过下雨，没见过下馅饼的
2304,吃饭前要洗手,这个习惯很好
2305,马航飞哪里去了,不知道飞哪了
2306,马航去哪儿了,不知道飞哪了
2307,马航去哪了,不知道飞哪了
2308,马航到底去哪儿了,不知道飞哪了
2309,马航到底去哪了,不知道飞哪了
2310,你知道支付宝吗,支付宝是国内领先的第三方支付平台
2311,电话响了,哎呀，谁找我呀
2312,你的电话响了,哎呀，谁找我呀
2313,发型不错,谢谢夸奖啦
2314,智商的简称是什么,IQ
2315,情商的简称是什么,EQ
2316,原因是啥,没有什么为什么
2317,这是为什么,没有什么为什么
2318,那是为什么,没有什么为什么
2319,头发没了,据说光头的人聪明呢
2320,你对现在的生活的看法,每天很充实当然满意
2321,现在生活的咋样,每天很充实当然满意
2322,现在生活的怎么样,每天很充实当然满意
2323,为了明天我们一起加油好吗,加油
2324,为了明天大家一起加油,加油
2325,为了明天大家一起加油好吗,加油
2326,明天加油,加油
2327,未来加油,加油
2328,滚你大爷的,我才出生没多久呢，好多不懂的，您多包涵~~~
2329,滚你的,我才出生没多久呢，好多不懂的，您多包涵~~~
2330,滚去死,我才出生没多久呢，好多不懂的，您多包涵~~~
2331,滚一边去,我才出生没多久呢，好多不懂的，您多包涵~~~
2332,滚远点,我才出生没多久呢，好多不懂的，您多包涵~~~
2333,又败得那么惨,最穷无非讨饭，不死终会出头！记住了，年轻没有失败，自信创造精彩！
2334,又不是叫你说,哦，对不起
2335,又到了低谷,人生最低处有一个好处，就是无论从哪个方向努力，都是向上。
2336,又给你添了不少麻烦,医生是救死扶伤的白衣天使
2337,又过一天,人生在世，只争朝夕
2338,真的呀,是啊
2339,真滴啊我爱你萌萌,我也爱您
2340,真累你们,只要能看到客户满意的笑容，再辛苦也是值得的。
2341,真冷?,躲被窝
2342,真理都是真的吗,真理掌握在少数人手中
2343,真理可以探究吗,真理就是智慧之根，或者说，真理就是智慧本身。
2344,我带你去四周逛逛吧,好的。
2345,我带你四处逛逛,好的。
2346,我带你四处看看,好的。
2347,我的照相机找不到了,不要着急，好好想想放在哪了
2348,这张电影票的价格是多少,具体的价格请上网查询。
2349,这张车票的价格是多少,具体的价格请上网查询。
2350,这张飞机票的价格是多少,具体的价格请上网查询。
2351,这件衣服的价格是多少,看标签，上面有价格。
2352,这条裤子的价格是多少,看标签，上面有价格。
2353,这条围巾的价格是多少,看标签，上面有价格。
2354,这双鞋的价格是多少,看标签，上面有价格。
2355,这顶帽子的价格是多少,看标签，上面有价格。
2356,这双袜子的价格是多少,看标签，上面有价格。
2357,过生日要花多少钱,生日和家里人吃顿饭，既温馨又省钱，多好。
2358,从张江去虹桥坐几号线,2号线
2359,上海有什么好玩的地方,东方明珠、南京步行街、外滩、豫园、世博中国馆、一大会址、鲁迅故居、静安寺、上海大剧院等等
2360,你会下棋吗,小龙人还不会下棋呢。
2361,废电池乱丢会对人体可能造成什么伤害啊,废电池中含有汞、镉、铅、锌等重金属有毒物质。人若汞中毒，会损害中枢神经系统。
2362,去倒杯水给我好吗,没问题。
2363,拿一杯水给我行不行,没问题。
2364,能否帮我倒一杯水,没问题。
2365,可不可以倒一杯水给我,没问题。
2366,能不能把那杯水拿给我,没问题。
2367,帮我倒杯水,没问题。
2368,去给我倒杯水,没问题。
2369,给我倒杯水吧,没问题。
2370,你能不能给我倒杯水喝？,没问题。
2371,你能不能给我倒杯水,没问题。
2372,帮我拿杯水吧,没问题。
2373,帮我拿杯水,没问题。
2374,给我拿杯水吧,没问题。
2375,把水拿给我吧,没问题。
2376,把水递给我,没问题。
2377,把水递给我吧。,没问题。
2378,麻烦你把水拿给我,没问题。
2379,你喜欢吃什么水果,我喜欢橘子和苹果。
2380,吃些蛋糕吧,谢谢。
2381,吃一点零食吧,我不太喜欢吃零食。
2382,我可以进去吗,当然，请进。
2383,我可以吃一点吗,当然，请随便吃。
2384,你知道他的电话号码吗,我不知道。
2385,帮我打个电话给他,好的。
2386,你确定吗,确定一定以及肯定。
2387,你喜欢画画吗,不喜欢，太难了。
2388,我想画一幅画缺个模特,我给您当模特吧。
2389,机器人要吃东西吗,我不用吃东西也可以精神饱满的哦。
2390,电子计算机发明于哪一年,计算机是 1946 年在美国发明的。而电脑(微机)的出现是 20 世纪 70 年代。
2391,吉他有多少跟弦,6根
2392,七大洲中面积最小的是,大洋洲
2393,在狗的眼睛里世界是什么颜色的,只有黑白灰色
2394,铁锅通常用哪种铁制成,生铁
2395,世界上最大的冰川在哪个洲,南极洲
2396,坏血病是因缺什么而造成的,维生素C
2397,坏血病怎么造成的,缺少维生素C
2398,古代著名的水利工程都江堰是谁设计的,李冰父子
2399,为什么会发生月食,月亮转到了地球阴影里
2400,月食是怎么发生的,月亮转到了地球阴影里
2401,和我玩玩羽毛球吧,生命在于运动，乐意奉陪。
2402,你可不可以陪我打蓝球啊,生命在于运动，乐意奉陪。
2403,你能否陪我一起打蓝球,生命在于运动，乐意奉陪。
2404,我们一起去打蓝球吧,生命在于运动，乐意奉陪。
2405,咱们一起去打篮球好吗,生命在于运动，乐意奉陪。
2406,打篮球去,生命在于运动，乐意奉陪。
2407,和我玩玩篮球吧,生命在于运动，乐意奉陪。
2408,你可不可以陪我打足球啊,生命在于运动，乐意奉陪。
2409,你能否陪我一起打足球,生命在于运动，乐意奉陪。
2410,我们一起去打足球吧,生命在于运动，乐意奉陪。
2411,和我玩玩足球吧,生命在于运动，乐意奉陪。
2412,踢足球去,生命在于运动，乐意奉陪。
2413,你可不可以陪我看电影啊,荣幸之至。
2414,你能否陪我一起看电影,荣幸之至。
2415,你是否可以陪我看电影,荣幸之至。
2416,和我一起看电影好吗,荣幸之至。
2417,咱们一起看电影吧,荣幸之至。
2418,可以陪我看电影吗,荣幸之至。
2419,陪我看电影,荣幸之至。
2420,可以和我一块去看电影吗,荣幸之至。
2421,去看电影吧,荣幸之至。
2422,告诉我上海有多大,看不到边。
2423,你知道上海的面积吗,看不到边。
2424,上海的地理面积是多少,看不到边。
2425,怎么没反应的,思考中。。稍等我一下下
2426,怎么没回应了呀,思考中。。稍等我一下下
2427,怎么没人回答啊,思考中。。稍等我一下下
2428,怎么没人在啊,来啦来啦
2429,怎么没有人答复我,有什么可以帮您的呢
2430,最近你好吗,还不错哦
2431,最近穷啊,这样啊，那就要精打细算。然后还要努力挣钱~
2432,最近生活压力比较大,有压力才有动力。
2433,最近无聊的很,找我聊聊天吧，有我陪您，您就不会感到无聊啦。
2434,最近有点烦,那就跟我说话聊天吧。
2435,最近有什么预存话费的活动吗,亲，您可登录后选择在线人工寻求帮助，我的其它朋友们会竭诚为您服务！人工在线服务时间：9：00-22：30。谢谢！
2436,最近在干吗,忙着回答问题啊，来找我的人可多了。
2437,最近在干嘛呀,忙着茁壮成长，更好的服务于您啊
2438,最近在干什么,忙着茁壮成长，更好的服务于您啊
2439,最近在忙什么,忙着茁壮成长，更好的服务于您啊
2440,刚刚才睡醒还有点迷糊,那您赶紧去洗把脸清醒一下吧
2441,我想学英语,这是好事。
2442,你教我学英语好吗,我也不是很会啊
2443,那应该怎么学英语,您可以去找一些培训机构，找专业人士教您。
2444,我想学日语,这是好事。
2445,煎饼果子是哪个地方的风味小吃,天津
2446,东方明珠塔多高,468米
2447,万里长城的起点是哪里,山海关
2448,哪位皇帝修筑了万里长城,秦始皇
2449,卧龙先生是谁,诸葛亮
2450,韦小宝有多少个老婆啊,七个啊
2451,巴黎凯旋门是为纪念谁而建,拿破仑
2452,破釜沉舟这个成语出于哪次战争,巨鹿之战
2453,在我国内地驾驶车辆必须遵守左侧通行规则还是右侧通行规则,右侧通行的原则
2454,人类社会第一项伟大的技术发明是,钻木取火
2455,古代修筑长城有什么作用,为了防止北方游牧民族的侵犯，为了防止匈奴的搔扰
2456,为什么人和人的长相不一样,由于每个人的基因组合不同，所以其长相也不同。
2457,人高兴或害羞的时候脸为什么就会发红,人高兴或害羞的时候，交感神经兴奋，心血管机能亢进，血管扩张，尤其脸部毛细血管扩张，脸就会发红。
2458,为什么害羞的时候会脸红,人高兴或害羞的时候，交感神经兴奋，心血管机能亢进，血管扩张，尤其脸部毛细血管扩张，脸就会发红。
2459,闰年的一年有多少天,366天
2460,动物在什么情况下可以几十天不吃不喝而不会死亡,冬眠
