qid,question,answer
890,手机银行转账不成功,一、如果您未开通手机银行，请到柜台或智慧柜员机开通；二、如果您更换了手机号，为变更手机银行签约手机号；请到柜台或智慧柜员机关闭原签约手机号后，用新手机号重新开通即可。
891,更改预留手机号,请您携带有效身份证件、储蓄卡和手机到柜台修改，请刷身份证取号；如是信用卡，请拨打“95533—2信用卡”咨询。
892,你能做什么,我会陪您聊天，还可以回答您的业务问题。
893,借记卡开户,使用身份证开户可以直接到VTM机办理，方便又快捷；如果使用其他证件开户请前往柜台办理。
894,推荐信用卡,我行有很多种类的信用卡，南航龙卡、天河城百货龙卡、汽车卡、粤通卡等等，每一种卡片都有不同的优惠，总有一款适合您，请您前往柜台咨询。
895,你吃早饭了吗,小龙人是不需要吃饭的哦～
896,什么是约定还款,约定还款，是指您在我行开立储蓄账户，作为龙卡信用卡的约定还款账户，我行自动在到期还款日次日从该账户中扣划相应的人民币、外币进行还款，让您告别忘记还款的问题，用卡还款更轻松。
897,未成年人开户,未满16周岁应由法定代理人代办。办理所需材料：代办人身份证，申请人有效身份证件，监护关系证明。
900,你今年多少岁,我是属龙的
901,非常感谢,不客气，四海之内皆兄弟
902,取号需要什么证件,取号需要携带身份证或者银行卡
904,银行卡开户,如需办理借记卡，请持身份证直接到VTM机办理。如需办理信用卡，请您前往柜台办理。
906,什么是保险产品犹豫期,投保人身保险时，从收到保单并书面签收之日起10日内可以选择是否退保，这个称为犹豫期。如果认为投保的产品与需求不符，投保人可以在犹豫期内无条件解除合同。保险公司应在扣除不超过10元的成本费用后，退还全部保费。
907,如何在自助设备上转账,请按照自助设备屏幕上的提示进行操作，并在转账前仔细确认收款账号及户名的正确性（姓氏以*代替，显示“*”加“名字”），请认证核对后再确认转账。
908,你最喜欢金总唱的哪首歌,金总的全民K歌上所有的歌曲都非常好听，小龙人都很喜欢。如果说最喜欢哪一首，那就是下一首。
911,房屋装修能否提取住房公积金,个人装修自有住房满足规定要求的，可以提取住房公积金。具体信息请咨询公积金办理柜台。
913,借记卡激活,您好，请带上您本人的身份证和银行卡到智慧柜员机办理
914,短信通知余额提醒,如果您想要在短信通知中显示余额，可用签约手机编缉短信“KTYE#账户后四位”发送至95533开通
916,开户需要什么证件,您好，国内公民开户需要携带身份证，外国公民可以用外国护照，港澳居民可以用港澳通行证，台湾居民可以用往来大陆通行证办理哦。
917,如何申请信用卡临时额度,请填写额度申请表，并提交相应的资产证明。如果额度提升大于100%的，建议找网点客服人员推荐。我行将在收到申请3个工作日后短信通知调额结果。
918,有效身份证件,中国居民：有效身份证件，临时身份证及辅助证件中国居民不满16周岁：身份证或户口本未领身份证的军人、武警：军人、武警身份证，提供尚未领身份证的证明港澳居民：港澳通行证台湾居民：台湾往来大陆通行证外国公民：外国护照
919,临时身份证可以开户吗,使用临时身份证开户，还需提供以下任意一种身份证明：户口本、驾驶证、护照、居住证等。
920,理财产品到期怎么取,理财产品到期后自动返还银行卡，到期时间为：1、总行发行理财产品到期日后，一到三个工作日到账；2、省行发行理财产品到期日当天到账。
921,信用卡境内消费手续费,我行信用卡在国内刷卡消费手续费全免
923,退休人员提取公积金需要什么材料,退休人员提取公积金需要的材料：一、公积金提取申请表。二、身份证、公积金存折。三、退休人员退休证，男性60周岁以上，女性55周岁以上可不提供退休证
925,信用卡什么时候还款,信用卡还款日是账单日后20天
926,信用卡到期换卡密码,到期续卡的客户，新卡开卡成功后旧卡失效，密码沿用旧卡的
927,来一段freestyle,看我的表演吧：冷飕飕的寒风让我一直在抖 ，你看我的表情说我长得太逗，我心里只想穿件衣服把手揣兜。
928,自助设备办理跨行转账到账时间,在自助终端上办理的向非本人账户转账24小时到账，具体到账时间建议联系银联95516咨询。
929,什么是银行代销产品,银行代销产品，即银行代理销售的由基金公司、保险公司、信托公司等其他机构设计并承担主要责任的产品。
933,遗忘住房公积金联名卡密码,如果您遗忘了住房公积金联名卡的储蓄账户密码，请办理密码重置；如果忘记了公积金账户密码，请准备好住房公积金联名卡和身份证明文件，前往可以办理公积金业务的网点重新设置密码。
934,住房公积金缴存情况,您可以登录住房公积金中心官方网站，拨打热线电话，或者前往公积金业务银行网点查询个人住房公积金账户信息。
935,申请贵宾卡多久可以取卡,我行贵宾卡都是专门为您订做的哦！提交申请表后10天可以取卡。
937,转账时收款账户信息有误或者转错人了如何处理,如转账时因收款户名、账号等填写有误导致资金无法入账，由收款行发起退款后，我行将资金退还到付款账户；如发生错入账收款人不退还的，建议您及时寻求司法帮助。
938,借记卡境外取款手续费,我行的储蓄卡在境外银联ATM取款，手续费为取现金额1%，每笔最低14元，在非银联的ATM取现，手续费为取现金额3%，每笔最低3美元
940,如何查询通过个人网银办理的转账记录,请登录个人网上银行，选择“转账汇款—其他转账功能—结果查询”进行查询，还点击“查询更多”后，选择输入起止日期、付款账户等条件，查询一个月内（包括当天）的网银转账汇款交易记录。
942,如何通过手机银行进行缴费或充值,请您登录手机银行，选择“悦生活”后，根据需求进行缴费或充值，按页面提示操作。
943,利率的表现形式和换算,利率包括年利率、月利率和日利率。月利率等于年率除以12；日利率等于年利率除以360；日利率等于月利率除以30。
945,约定还款余额不足,若约定还款账户中余额不足支付本期应还款金额，将采用有多少扣多少的方式进行扣款。约定账户余额不足时，无法进行约定账户购汇还款。
947,储蓄卡挂失后如何解除挂失,临时口头挂失5天后自动解挂；如储蓄卡已办理书面挂失，请您携带本人有效身份证件需撤销挂失的储蓄卡、挂失申请书客户留存联至原挂失网点办理挂失撤销。
948,登录手机银行客户端时如何获取授权码,请您使用开通手机银行的手机号发送短信“88#88”至95533获取授权码。
950,通过个人网银办理跨行转账时为什么无法选择他行开户行网点,您无需选择至收款账户具体的开户网点名称，仅需选择收款账户所属行别
951,龙卡云闪付支付适用什么系统的手机,龙卡云闪付支付功能适用安卓4.4.2版本且具备NFC功能的手机。
952,龙卡云闪付借记卡的交易限额是多少,龙卡云闪付借记卡主账户联机支付交易限额，每笔消费最高5000元，每天累计消费最高5000元，取现限额同一般借记卡。
954,如何查询征信记录,您可以向所在地中国人民银行分支机构征信管理部门申请查询，中国人民银行征信中心联系电话为：4008108866。
956,通过第三方支付平台办理提现、退款、转账的到账时间是多久,我行在接收到第三方支付平台资金并核实信息无误后，会立即为您办理入账。如资金长时间未到账，请您致电第三方支付平台客服热线咨询。
957,已经在柜台签约了个人网银需要添加本人名下账户用于转账汇款类操作如何办理,您登录个人网银后，通过“我的账户—追加新账户”，按照提示添加账户。
959,本人名下只有一个储蓄账户在柜台开通了个人网银账户换卡了怎么办,请您带齐本人有效身份证件、新卡、手机、安全工具至柜台，注销网银后使用新卡重新签约，签约成功后建议您在七天内登录网银进行激活。
960,网银盾丢失了如何处理,为确保您的账户及网银使用安全，请尽快拨打95533办理网银盾挂失业务，挂失后，请您尽快持本人有效身份证件、任一网银签约储蓄卡或存折、手机至柜台购买网银盾并重新绑定。
963,未按时归还个人贷款会有什么影响,贷款未按时还款可能会产生罚息并影响个人信用记录，如有逾期，请尽快在贷款扣款账户中存入资金后，再观察是否补扣。如扣款不成功或无法及时还款，请尽快联系贷款经办行核实处理。
965,信用卡电话是多少,信用卡的客服热线是4008200588
967,为什么已经还了贷款还收到提示还款的短信,若您已还款仍收到贷款催收短信，可能是在您本次还款前统一发送的，建议您先通过95533、网银等渠道查询明细核实是否已扣款。若已正常还款，可忽略收到的催收短信。如查询后有疑问，建议您联系贷款经办行核实。
968,龙卡云闪付如何使用手机进行移动支付交易,在交易时，请解锁屏幕、开启NFC功能、靠近标有银联“闪付”标志的POS机，当听到POS机“嘀”声后，手机就会提示支付卡号、交易金额等信息，请您在POS机上输入密码，签名后即可完成支付交易。
969,提前还贷,这个问题您可以咨询我行的理财经理哦
972,个人网银用户名遗忘怎么办,用户名遗忘处理方式如下：1.如只能用用户名登录，请点击网银登录页面右侧的“忘记用户名”，恢复证件号码登录；2.如可使用证件号码登录网银，请登录后通过“客户服务—用户名设置”菜单直接重置；3.如是网站自行开通的网银，可点击“个人网上银行注销”后重新开通。
973,如何解绑手机银行客户端（原手机无法使用）,解绑手机银行客户端有以下两种方式：1.网银盾客户通过个人网银“我的账户—其他账户服务—渠道互动签约—手机银行客户端管理”解除绑定2.注销手机银行，重新自行注册申请成为手机银行非签约用户或前往柜台办理签约手续。
974,万事达卡收费问题,信用卡在境外消费可能会产生的费用有：汇兑手续费、取现手续费和查询费用。请点击下方按钮了解对应手续费收取情况：
975,外币信用卡还款方式,您可以通过以下方式归还信用卡外币欠款：1、登录个人网银，点击“信用卡—卡账往来—为本人还款”，按卡号操作购汇还款或者一键还款。2.您可以登录手机银行，通过“信用卡—为本人还款”，选择信用卡账户，选择还款币种，还款类型可选择购汇还款或同币种还款，之后根据页面提示操作。3、如您持有外币现钞，可至网点柜面办理外币还款。
976,个人网银归还信用卡外币欠款,登录个人网银，点击“信用卡—卡账往来—为本人还款”，选择信用卡卡号和外币币种后，即可通过购汇还款或同币种还款方式归还本人信用卡外币欠款；如需为他人信用卡还外币欠款，请您前往我行的柜台为相应的账户存入人民币或外币。
977,VISA卡在境外遗失,如果您在境外遗失我行信用卡，请您及时登录手机银行办理挂失，或拨打我行境外客服热线86-28-95533办理挂失。
978,停用信用卡,很抱歉我行信用卡未能让您满意。如您想办理销户，请您结清卡片账务后，致电我行客服热线95533（境外请拨打86-28-95533）办理销户登记。登记完毕后，请您自行将卡片磁条剪断。
979,打印信用卡明细,1.如果您的账单寄送方式为纸质账单，那就无法再到柜面打印交易明细，如果寄送方式为电子账单，那您可以持有效身份证件和信用卡到柜台打印交易明细。2.我行手机银行和智慧柜员机的信用卡频道都可以查询信用卡交易明细，建议您通过这两个渠道进行自助查询。
980,信用卡刷卡消费注意事项,您在刷卡消费时，需注意以下几点：1、卡片应始终在您的视线范围内。2、输入密码时，用身体遮挡操作手势。3、签名前要仔细核对签购单上的卡号和金额。4、签购单上的签名应与卡片背面的签名一致。5、不要在空白签购单或在未填妥金额的签购单上签名。6、交易取消时，应确认签购单已销毁。7、签账后确认商店人员交还的卡片确实是自己的卡片。8、收到当月对账单前注意保存签购单存根联，以备核对信息。
981,信用卡境外消费注意事项,境外信用卡消费过程中，您需要特别留意以下几点：1、签购单上小费金额，消费总金额，特别是餐饮商户。如对小费栏位有异议，应及时向商户提出。2、签购单和pos机显示的消费金额的币种是否正确。
982,银联在线跨行还信用卡,您可登录中国银联在线支付网站使用借记卡为我行信用卡还款，支持此项业务的银行成员名单以银联官方网站公布为准。详情请登录http://online.chinaunionpay.com。
983,信用卡邮寄情况,信用卡审批通过后，我行将尽快为您制卡并邮寄，同时向您发送寄卡通知短信，短信中含卡片邮寄编码和邮寄进度查询渠道，您可按提示查询卡片寄送情况。
984,信用卡还款利息的试算,您可登录个人网银或手机银行，在“信用卡—为本人还款”菜单中，输入还款金额进行试算。
985,手机银行外汇转账,1.手机银行暂无境外汇款功能，您可以通过个人网银或柜台办理。2.目前手机银行可办理省内本人名下外币转账，您可以通过“首页—转账—境内外币转账”办理。
986,询问信用卡额度是否固定,您好，我行信用卡都有固定额度的，您也可申请提升固定额度或者临时额度
987,手机银行外汇转账限额限制,您好，单笔汇款金额不超过等值20万人民币，且受到短信验证码转账功能开通时自行设定的转账限额限制。
988,手机银行挂失,1.挂失储蓄卡：请您点击手机银行首页“财富”，选择需要挂失的账户，点击“详情-挂失”选择临时挂失（5个工作日有效）或永久挂失（长期有效），请在挂失有效期内到网点办理后续业务。注意：准贷记卡和陆港通龙卡挂失为长期有效；2.挂失信用卡：通过“信用卡-信用卡管理-信用卡挂失”菜单，选择挂失类型，根据提示办理。注意：因手机版本不同，操作路径可能存在差异。
989,手机银行修改预留手机号,您好，手机银行暂不支持手机号码修改，请您持个人银行卡和有效身份证件到柜台或大堂的智慧柜员机办理，修改手机号码只能本人办理。
990,手机银行预留信息修改,您好，手机银行及大众版均无法修改一卡通及信用卡的预留手机号码。
991,手机银行注销,目前我行手机银行免收服务费，建议您保留使用。如需注销手机银行，可选择如下方法： 1、点击手机银行客户端左上角“≡”图标，选择“安全中心—注销手机银行”菜单，根据页面提示输入手机号码、相关账号和密码以及系统发送的短信验证码，系统验证通过后即可完成注销。 2、可持本人有效身份证件、银行卡前往柜台办理。
992,咨询自助区电话银行能否拨打客服,您好，可以的，客服热线95533。
993,ATM&CRS存钱卡钞,您好，您先别着急，我请我们工作人员帮您看一下。
994,消费分期的好处,消费分期的优点：申请该业务的消费可不受商店和商品的限制，只需交易符合我行条件，每月支付一定手续费，即可办理。
995,补发网银盾业务,已开通网银盾的客户持银行卡/活期存折可通过智慧柜员机办理补发网银盾业务。操作如下：1. 在主页选择“网络金融服务-补办网银盾”，验证银行卡/活期存折，并输入密码。2. 插入身份证，拍照验证，等待审核3. 阅读提示4. 确认交易信息，等待工作人员指纹授权5. 打印凭条，完成交易
996,个人存款证明定义,个人资信证明业务已经覆盖原存款证明业务，目前一律使用个人资信证明凭证。请查看个人资信证明业务介绍。
998,教育储蓄的存款期限,您好，教育储蓄的存期有一年、三年和六年。
999,教育储蓄的利息,一年期、三年期教育储蓄按开户日同期同档次整存整取定期储蓄存款利率计算；六年期教育储蓄按开户日五年期整存整取定期储蓄存款利率计算。
1000,教育储蓄的存款限额,您好，教育储蓄起存金额为人民币50元，本金合计最高限额人民币2万元。
1001,ATM&CRS手机预约取款,您可以有以下方式可以进行特约取款：1、登录手机银行，首页选择+号，点击特约取款，自动进入下一步，点击申请特约取款。2、登录个人网银，通过“我的账户—更多服务—特约取款—申请特约取款”菜单操作。 3、通过柜台预约办理特约取款。
1002,ATM&CRS刷脸取款,刷脸取款有以下两种方式：1、打开随芯用客户端，点击“刷脸取款”，选择取款账号、输入取款金额后进行刷脸。刷脸成功后，您在随芯用客户端点击“扫码二维码”，并且在ATM上点击“刷脸取款”，用随芯用扫描ATM屏幕二维码后即可从ATM领取钞票。2、在ATM上点击“刷脸取款”，打开随芯用客户端，点击右上方“扫一扫”，用随芯用扫描ATM屏幕二维码。再选择取款账号、输入取款金额后进行刷脸。刷脸成功后，在随芯用点击“确认出钞”后，即可从ATM领取钞票。
1003,ATM&CRS异地卡取款,您好，异地卡是可以在自助存取款机上取钱的。
1005,ATM&CRS取外币,对不起，我行自助设备暂不支持外币现金取款，外币兑换机支持外币现金兑换。
1006,ATM&CRS在电子现金账户取款,您好，目前电子现金账户的资金无法通过取款机提现，该账户的资金只能用于消费。
1007,储蓄卡长期不使用是否影响信用记录,目前我行储蓄卡长期不使用暂时不会影响个人信用记录。但储蓄卡每年会产生账户管理类费用，同时储蓄卡长期不使用可能导致账户状态不正常。如您确定不再使用我行储蓄卡，建议尽快到我行办理销户。
1008,挂失补卡后签约关系是否会改变,挂失补卡后，卡号会发生变化；可能会影响到房贷还款、信用卡约定还款、代扣代缴、证券保证金第三方存管、基金、国债、账户金等业务的办理。如您的银行卡签约了上述功能，请及时到我行网点申请签约卡号变更。补办工资卡的，请及时将新卡号告知单位财务部门。
1010,如何补缴短信银行服务费,请您使用签约手机号码发送“BJQF#短信签约账号后四位”至95533，系统将返回欠费信息及交易验证码。如需补缴，请回复“QR#交易验证码”进行缴费即可。
1012,贷款扣款日为什么扣款失败,"如贷款约定扣款账户在扣款日存在账户余额不足或账户状态不正常等情况,会导致扣款失败，请预存足够款项或到柜台查询账户状态。"
1014,龙卡云闪付支付的账户类型有哪些,龙卡云闪付支持借记卡和信用卡，采取以卡开卡的方式，与申请时验证的银行卡共用账户及密码，不支持电子现金，不支持脱机交易。
1015,你们这里有没有美元,您可以到智慧柜员机办理购汇后直接取款。
1016,如何缴交通罚款,缴交通罚款通过：1、微信银行，选择悦生活，生活缴费。2、登录手机银行，选择悦生活，娱乐出行。3、网点自助终端缴费
1018,信用卡还款小贴士,一、如果信用卡没有按时还款，则消费款项不再享受免息还款待遇；对最低还款额未还部分，还会按月收取5%的滞纳金。二、欠款记录可能被反馈至中国人民银行个人征信系统，影响持卡人的信用记录。三、小龙人建议您开通约定账户还款，如果账户余额不足，可选择最低还款额还款。
1022,如何通过电话银行办理定期与活期之间的转账,"请拨打95583后，选择“1个人业务—5转账”,输入账号（身份证号）和电话银行密码，再选择“1转账汇款”，按提示输入付款账号后四位或账户编号，根据语音提示操作即可。"
1024,你为什么认识金总,金总可是全民K歌的超级人气偶像！人帅歌棒球技高，小龙人当然认识啦！
1025,信用卡资料修改,可以取号办理。建议请您带上身份证和信用卡到网点智慧柜员机办理。
1027,手机无法接受短信验证码,手机收不到短信验证码，请确认以下事项：1. 手机状态是否正常2. 您在我行预留的手机号码是否正确，手机号码的查询和修改可到我行柜台或智慧柜员机办理。
1030,你怎么认识我,因为您是我们的VIP客户啊，我们时刻将上帝装在心里。
1031,手机银行的登录密码遗忘或锁定了如何处理,手机银行登录密码当日连续输错3次会锁定，第二日可自动解锁。如您遗忘登录密码，请您携带本人有效身份证件、签约手机银行的储蓄卡到智慧柜员机或柜台办理重置。
1032,什么是手机到手机转账,手机到手机转账是指手机银行签约客户向其他手机用户以手机号码替代银行账户的转账方式
1033,说英语,"Yes, I can."
1034,公积金贷款首付比例是多少,使用住房公积金贷款购买住房，各个地区情况可能不一样哦。您可以前往柜台咨询详细情况。
1035,如何办理约定还款,您可以通过网上银行、手机银行、信用卡服务热线，或者到柜台开通约定账户还款服务。请注意签约的信用卡须为主卡，且储蓄账户和信用卡都是您本人名下的。
1038,银联缴费,此项缴费可直接在网点的银联易办事终端办理，方便又快捷哦~您也可以试试我行手机银行，足不出户就可以轻松办理缴费充值业务哦~
1039,未叫到号,不好意思，让您久等了。哥哥姐姐们都在辛勤为大家服务，请您再耐心等候一下。
1040,如何通过手机银行办理特约取款,请登录手机银行，通过“特色服务—特约取款”功能进行申请，之后您可凭收到的取款ID号和您设置的密码通过我行自助设备“特约取款”进行无卡取现，方便快捷。温馨提示：目前支持的账户类型为龙卡通、准贷记卡及理财卡。
1043,ATM&CRS忘记密码转账,您好，在自助取款机上转账必须要输入密码。如果忘记密码建议您通过“无卡/无折存款”将现金存入对方账户。
1044,ATM&CRS无卡转账无折转账,您好，如果您没带卡或者存折，建议您通过“无卡/无折存款”将现金存入对方账户。
1046,ATM&CRS他行卡转账,您好，我行ATM机可以办理他行银联卡转账业务。
1047,ATM&CRS现金汇款,ATM机是不可以办理存钱汇款业务的，CRS可以将现金存入对方的银行卡上。为了您的资金安全，转账前请确认好账户信息。
1048,ATM&CRS跨行转账,您好，您可以通过我行自助设备可以办理跨行转账业务。跨行转账业务会收取一定手续费用。
1050,ATM&CRS撤销转账,您好，行内转账在自助设备上在24小时内是可以撤销的，交易产生的手续费也可一并撤销，您可通过自助设备、柜台或电话银行撤销转账服务；跨行转账，我行提供交易受理后24小时内通过柜台和电话银行人工撤销转账服务，自助设备无法受理。
1052,“蓝豹百大”龙卡联名卡有无附属卡,“蓝豹百大”龙卡联名卡无附属卡。
1053,ATM&CRS从卡转到电子现金账户,真的很抱歉，目前我们ATM或者CRS设备上不支持此项业务，但是您可以直接把现金存入电子现金账户。
1054,ATM&CRS人民币转外币账户,您好，目前不能在自助取款机上办理此业务，您可以通过柜台将钱存入美元/外币账户。
1055,ATM&CRS查询余额,您好，可以在自助设备上查询余额的，您只要知道交易密码就可以。
1057,ATM&CRS修改密码,您好，您只要知道原始密码就可以在我行智慧柜员机上修改您的银行卡密码。
1058,ATM&CRS还信用卡,您好，现金还款您可以直接在ATM、CRS机上选择“信用卡还款”然后存入现金；银行卡还款的话，您可以选择转账功能，直接将欠款汇入您的信用卡账户，本行信用卡还款免手续费哦。
1059,ATM&CRS查询信用卡账单,真的很抱歉 ，目前我们ATM、CRS上是不能查询信用卡账单的。
